{
  "$schema": "http://json-schema.org/draft-07/schema#",
  "type": "array",
  "items": {
    "type": "object",
    "required": [
      "venue",
      "date",
      "title",
      "startTime"
    ],
    "properties": {
      "id": {
        "type": "string"
      },
      "venue": {
        "type": "string"
      },
      "date": {
        "type": "string",
        "format": "date"
      },
      "title": {
        "type": "string"
      },
      "startTime": {
        "type": "string",
        "pattern": "^\\d{2}:\\d{2}$"
      },
      "artists": {
        "type": "array",
        "items": {
          "type": "string"
        }
      },
      "url": {
        "type": "string",
        "format": "uri"
      }
    },
    "additionalProperties": false
  }
}