[
  {
    "id": "d751ca4c",
    "title": "fi = altshift5 w/ ANFISA LETYAGO & ICYKOF & DAS IST DAS JA",
    "venue": "fi",
    "date": "2025-07-04",
    "startTime": "23:00",
    "artists": [
      "ANFISA LETYAGO",
      "ICYKOF",
      "STIKDORN",
      "JAN OBEN",
      "PILETA B2B ANANDA PRIORI",
      "PLAY BOY JOE"
    ],
    "url": "https://www.eventbrite.com/e/fi-altshift5-w-anfisa-letyago-icykof-das-ist-das-ja-tickets-1423700670029?aff=ebdsoporgprofile&keep_tld=1"
  },
  {
    "id": "11addd38",
    "title": "fi = altshift5 w/ Dyed Soundorom & Avontuur & Chromatik",
    "venue": "fi",
    "date": "2025-07-11",
    "startTime": "23:00",
    "artists": [
      "DAVID DRÃ–GE b2b SOPHIETJE",
      "DYED SOUNDOROM",
      "SIMON BEHRENDT b2b ARNDSON",
      "CLARA LUISE",
      "JAKOB B.",
      "MARVIN RICHTER"
    ],
    "url": "https://www.eventbrite.com/e/fi-altshift5-w-dyed-soundorom-avontuur-chromatik-tickets-1408853351299?aff=ebdsoporgprofile&keep_tld=1"
  },
  {
    "id": "af8b4eff",
    "title": "fi = altshift5 w/ Marcel Dettmann & Plasma & rau.ton",
    "venue": "fi",
    "date": "2025-07-26",
    "startTime": "23:00",
    "artists": [
      "ELISEN",
      "MARCEL DETTMANN",
      "PILETA B2B EVA MO",
      "BORG BORG",
      "MAKAHAUN",
      "ROSTOM",
      "R:SELECT"
    ],
    "url": "https://www.eventbrite.com/e/fi-altshift5-w-marcel-dettmann-plasma-rauton-tickets-1437179134479?aff=ebdsoporgprofile&keep_tld=1"
  }
]