[
  {
    "title": "fi x Cologne Is For Lovers",
    "venue": "fi",
    "date": "2026-11-07",
    "startTime": "23:00",
    "artists": [
      "DJ Deep",
      "Tom Kutsche",
      "Femdelic",
      "DJ Funky Fresh Mike"
    ],
    "url": "https://rausgegangen.de/en/events/fi-x-cologne-is-for-lovers-0/",
    "id": "df46e759"
  },
  {
    "title": "fi x ELFTER ELFTER x Kalte Liebe & Akt",
    "venue": "fi",
    "date": "2026-11-11",
    "startTime": "18:00",
    "artists": [
      "DJ Hörde",
      "Evissimax",
      "Kalte Liebe (DJ Set)",
      "Kimme",
      "Paaradoxx",
      "Ursula Erdmann",
      "Zahnatzin"
    ],
    "url": "https://rausgegangen.de/en/events/fi-x-hyper-dreams-akt-0/",
    "id": "c65e82f6"
  },
  {
    "title": "fi x && x Tipping Point w/ Frida Darko",
    "venue": "fi",
    "date": "2026-11-14",
    "startTime": "23:00",
    "artists": [
      "Frida Darko",
      "Atric",
      "Sahra Bass",
      "ksheesh & fröhlich",
      "NUAH",
      "V. Paul"
    ],
    "url": "https://undundbooking.ticket.io/sA67nkD0/",
    "id": "96918a56"
  },
  {
    "title": "fi x Traumer & Akte",
    "venue": "fi",
    "date": "2026-11-20",
    "startTime": "23:00",
    "artists": [
      "Traumer",
      "Interplay b2b Phil2",
      "Isabell b2b Mira Mertens",
      "Costanza",
      "Philipp Stoffel"
    ],
    "url": "https://rausgegangen.de/en/events/fi-x-traumer-akte-0/",
    "id": "dea782b8"
  },
  {
    "title": "fi x Dominik Eulberg & neunsechsneun",
    "venue": "fi",
    "date": "2026-11-21",
    "startTime": "23:00",
    "artists": [
      "Dominik Eulberg",
      "Cosanne",
      "Frau Rü",
      "André Wiese",
      "Carl1ta",
      "DJ Bowlz",
      "PATEK"
    ],
    "url": "https://www.eventbrite.de/e/fi-x-dominik-eulberg-neunsechsneun-tickets-2002691718842",
    "id": "234f5544"
  },
  {
    "title": "fi x Dr. Banana & avontuur & Kontur",
    "venue": "fi",
    "date": "2026-11-28",
    "startTime": "23:00",
    "artists": [
      "Dr. Banana",
      "Simon Behrendt",
      "Soft Force b2b DJ Flatbeat",
      "Æko",
      "Kribs",
      "Kyohara",
      "Mariami"
    ],
    "url": "https://rausgegangen.de/en/events/fi-x-dr-banana-avontuur-kontur-0/",
    "id": "7147249c"
  }
]