[
  {
    "id": "32c59c6d",
    "title": "fi x Elfter Elfter w/ Teki Latex & Schleuse Eins & Lafari",
    "venue": "fi",
    "date": "2025-11-11",
    "startTime": "18:00",
    "artists": [
      "AINO B2B EVOLPEED",
      "RIO SALBEI B2B RAPHAEL HANSEN",
      "SEPARAT B2B AMSL",
      "TEKI LATEX",
      "SCHLEUSE EINS",
      "LAFARI",
      "ALBERTO & ALFORNO",
      "DADDY DEE",
      "ISIS",
      "STEVE BONDE",
      "ZAHARA"
    ],
    "url": "https://www.eventbrite.com/e/fi-x-elfter-elfter-w-teki-latex-schleuse-eins-lafari-tickets-1768340156009?aff=ebdsoporgprofile&keep_tld=1"
  },
  {
    "id": "bf1d13bc",
    "title": "fi = altshift5 w/ Patrick Mason & Flinta*Tunes",
    "venue": "fi",
    "date": "2025-11-29",
    "startTime": "23:00",
    "artists": [
      "KERIMA",
      "PATRICK MASON",
      "PHILO",
      "MARUHNI",
      "MAYD",
      "SKATHI"
    ],
    "url": "https://www.eventbrite.com/e/fi-altshift5-w-patrick-mason-flintatunes-tickets-1818977313109?aff=ebdsoporgprofile&keep_tld=1"
  },
  {
    "id": "75c7733a",
    "title": "fi x [a:rpia:r] & Avontuur",
    "venue": "fi",
    "date": "2025-12-12",
    "startTime": "23:00",
    "artists": [
      "PETRE INSPIRESCU",
      "RARESH",
      "RHADOO",
      "ARNDSON B2B SIMON BEHRENDT",
      "DAVID DRÖGE",
      "SOFT FORCE",
      "SOPHIETJE"
    ],
    "url": "https://www.eventbrite.com/e/fi-x-arpiar-avontuur-tickets-1739271801779?aff=ebdsoporgprofile&keep_tld=1"
  },
  {
    "id": "38c86291",
    "title": "fi = altshift5 w/ Dax J & Hoove",
    "venue": "fi",
    "date": "2025-12-19",
    "startTime": "23:00",
    "artists": [
      "DAX J",
      "KRACKK",
      "ROBIN TASI",
      "Hoove",
      "DAAN DONK",
      "JONAS KÖKSAL",
      "JULIAN FEIERABEND",
      "THALO SANTANA"
    ],
    "url": "https://www.eventbrite.com/e/fi-altshift5-w-dax-j-hoove-tickets-1783725323459?aff=ebdsoporgprofile&keep_tld=1"
  }
]