[
  {
    "title": "Adrenaline Open Air w/ 909 Racingteam, vagabund, Satys Fyre & Schwesta2Schwesta",
    "venue": "Odonien",
    "date": "2026-05-17",
    "startTime": "14:00",
    "artists": [
      "909 Racingteam",
      "vagabund",
      "Satys Fyre",
      "Schwesta2Schwesta"
    ],
    "url": "https://adrenaline.ticket.io/xP0e6OWE/"
  },
  {
    "title": "KOMM RAVEN x Slin x Nene H x Butschi",
    "venue": "Odonien",
    "date": "2026-05-22",
    "startTime": "23:00",
    "artists": [
      "Jan Trovato",
      "C-arla",
      "Nene H",
      "Slin",
      "Kilstad",
      "bilstad",
      "Butschi",
      "Hihat",
      "Eskarlation",
      "Alias3ooo",
      "Luzia",
      "ICX",
      "Shana",
      "Evi B"
    ],
    "url": "https://rausgegangen.de/en/events/komm-raven-x-slin-x-nene-h-x-butschi-odonien-0/"
  },
  {
    "title": "WIR Schwestern 20 Years - microFESTIVAL 2026 - Day & Night",
    "venue": "Odonien",
    "date": "2026-05-24",
    "startTime": "14:00",
    "artists": [],
    "url": "https://rausgegangen.de/en/events/wir-schwestern-20-years-microfestival-2026-day-night-im-odon-0/"
  },
  {
    "title": "Praerie Frühlings-Festival",
    "venue": "Odonien",
    "date": "2026-05-30",
    "startTime": "14:00",
    "artists": [
      "Teenage Mutants",
      "Konfusia",
      "Maurice Mino",
      "Sabura",
      "Tobi Dei",
      "Aio",
      "sin:port",
      "Daniel Krau",
      "Mr. Ciao",
      "Martin Ka"
    ],
    "url": "https://rausgegangen.de/en/events/praerie-fruhlings-club-festival-im-odonien-mit-space-92-alex-0/"
  }
]
