[
  {
    "id": "b1a40e1a",
    "venue": "Artheater",
    "date": "2025-12-05",
    "title": "HANDWERK Under Construction with Rosati, Marcel Janovsky & Boris X",
    "artists": [
      "Rosati",
      "Marcel Janovsky"
    ],
    "startTime": "23:00",
    "url": "https://ra.co/events/2310214"
  },
  {
    "id": "8ee21728",
    "venue": "fi",
    "date": "2025-12-05",
    "title": "fi x Feines Tier with Heimlich Knüller & nd_baumecker & Roe Deers & Keikee & Philipp Fein",
    "artists": [],
    "startTime": "23:00",
    "url": "https://ra.co/events/2313229"
  },
  {
    "id": "5bcc9403",
    "venue": "Artheater",
    "date": "2025-12-06",
    "title": "BergWacht with Bruno",
    "artists": [
      "Liho"
    ],
    "startTime": "23:00",
    "url": "https://ra.co/events/2314949"
  },
  {
    "id": "65631d26",
    "venue": "fi",
    "date": "2025-12-06",
    "title": "fi x Moyn Winterglow",
    "artists": [],
    "startTime": "23:00",
    "url": "https://ra.co/events/2309094"
  },
  {
    "id": "b5798477",
    "venue": "Trafic",
    "date": "2025-11-29",
    "title": "EXODIUM",
    "artists": [],
    "startTime": "23:00",
    "url": "https://ra.co/events/2310642"
  },
  {
    "id": "133365e6",
    "venue": "Garagen",
    "date": "2025-12-03",
    "title": "TECHNOLiEBE #AmMittwoch",
    "artists": [],
    "startTime": "19:00",
    "url": "https://ra.co/events/2313373"
  },
  {
    "id": "a332cc79",
    "venue": "JAKI",
    "date": "2025-12-12",
    "title": "YAYAxCHAYA",
    "artists": [
      "Gîn Bali",
      "no:elia",
      "Aaro (3)",
      "Andras_2020",
      "makahaun"
    ],
    "startTime": "23:30",
    "url": "https://ra.co/events/2307927"
  },
  {
    "id": "ca223f6f",
    "venue": "H26",
    "date": "2025-12-13",
    "title": "INHEAT. Cologne with Alberto Tolo - Danny Wabbit - Gilles Bock - Kraemer",
    "artists": [
      "Alberto Tolo",
      "Danny Wabbit",
      "Kraemer"
    ],
    "startTime": "18:00",
    "url": "https://ra.co/events/2308914"
  },
  {
    "id": "90ec4325",
    "venue": "Gewölbe",
    "date": "2025-12-13",
    "title": "Klubacht with DJ Frank, DJ Seinfeld, Sandilé",
    "artists": [
      "DJ Frank",
      "DJ Seinfeld",
      "Sandilé"
    ],
    "startTime": "23:00",
    "url": "https://ra.co/events/2314901"
  },
  {
    "id": "68ce7273",
    "venue": "Helios37",
    "date": "2025-12-19",
    "title": "DJ DRECKISCH WINTER TOUR x ART OF URBAN LIFE with WILDERICH, NYRA, TMR and many more",
    "artists": [
      "DJ DRECKISCH",
      "WILDERÍCH",
      "NYRA (DE)",
      "TMR (DE)",
      "TiDo",
      "nordcorreia.mp3"
    ],
    "startTime": "23:00",
    "url": "https://ra.co/events/2296104"
  },
  {
    "id": "53972680",
    "venue": "Bootshaus",
    "date": "2025-12-19",
    "title": "INURFASE MASSIVE - The Trinity Code",
    "artists": [
      "DitzKickz",
      "Dr Donk",
      "Lil Texas",
      "Lekkerfaces",
      "NAMARA",
      "Kili (3)",
      "Testarossa"
    ],
    "startTime": "22:30",
    "url": "https://ra.co/events/2283182"
  },
  {
    "id": "6eb67348",
    "venue": "JAKI",
    "date": "2025-12-19",
    "title": "Another Thought feat. comforter2 (live), Ultramax (live)",
    "artists": [
      "DJ Brom",
      "AMSL"
    ],
    "startTime": "21:30",
    "url": "https://ra.co/events/2299722"
  },
  {
    "id": "f064ad00",
    "venue": "Artheater",
    "date": "2025-12-19",
    "title": "ANIMADO - THE LAST DANCE (DAS FINALE BEVOR WIR AUFHÖREN)",
    "artists": [],
    "startTime": "23:00",
    "url": "https://ra.co/events/2237087"
  },
  {
    "id": "3f761769",
    "venue": "TBA - Barbarossa",
    "date": "2025-12-19",
    "title": "Beats, Bass, Barbarossa - Bassmusik in Aachen",
    "artists": [],
    "startTime": "23:00",
    "url": "https://ra.co/events/2295981"
  },
  {
    "id": "bfd9c61e",
    "venue": "Gewölbe",
    "date": "2025-12-20",
    "title": "My Dear with Kittin, Denis Stockhausen",
    "artists": [
      "Miss Kittin",
      "Denis Stockhausen"
    ],
    "startTime": "23:00",
    "url": "https://ra.co/events/2307071"
  },
  {
    "id": "0a653c6d",
    "venue": "King Georg",
    "date": "2025-12-20",
    "title": "Rhythmus im Blut mit Alex From Tokyo",
    "artists": [
      "Alex From Tokyo",
      "Tom Kutsche"
    ],
    "startTime": "21:00",
    "url": "https://ra.co/events/2275149"
  },
  {
    "id": "397618cc",
    "venue": "fi",
    "date": "2025-12-20",
    "title": "fi x Acid Pauli & Jonathan Kaspar & Plasma",
    "artists": [
      "Acid Pauli",
      "Jonathan Kaspar",
      "Elisen"
    ],
    "startTime": "23:00",
    "url": "https://www.eventbrite.de/e/fi-x-acid-pauli-jonathan-kaspar-plasma-tickets-1974357982875?utm-campaign=social&utm-content=attendeeshare&utm-medium=discovery&utm-term=listing&utm-source=cp&aff=ebdsshcopyurl"
  },
  {
    "id": "f3ae6e9d",
    "venue": "Bootshaus",
    "date": "2025-12-20",
    "title": "Bootshaus pres. AVAION - in the middle - / ZERB",
    "artists": [
      "AVAION"
    ],
    "startTime": "22:00",
    "url": "https://ra.co/events/2283195"
  },
  {
    "id": "6848f18f",
    "venue": "Schrotty",
    "date": "2025-12-20",
    "title": "Teddy Killerz ('COOKED' Tour), Tsuki, Formula, Gourski, + more - LoopLab Vol. 2",
    "artists": [
      "Teddy Killerz",
      "Formula LDN",
      "Gourski",
      "Badlokk"
    ],
    "startTime": "19:00",
    "url": "https://ra.co/events/2286305"
  },
  {
    "id": "cda78fa5",
    "venue": "Nachtigall",
    "date": "2025-12-20",
    "title": "CLUBNACHT with Aio, Pardis, Phi Φ, Juni, Bernau und Elias Paul",
    "artists": [
      "Aio",
      "Pardis"
    ],
    "startTime": "23:00",
    "url": "https://ra.co/events/2315134"
  },
  {
    "id": "716c7cbb",
    "venue": "Bootshaus",
    "date": "2025-12-20",
    "title": "Blacklist pres. Midnight Tyrannosaurus",
    "artists": [],
    "startTime": "23:00",
    "url": "https://ra.co/events/2308817"
  },
  {
    "id": "4ab5371d",
    "venue": "Gewölbe",
    "date": "2025-12-21",
    "title": "Research with evolpeeD, Sedaction, XDB",
    "artists": [
      "evolpeeD",
      "Sedaction",
      "XDB"
    ],
    "startTime": "14:00",
    "url": "https://ra.co/events/2314024"
  },
  {
    "id": "c208e547",
    "venue": "OFF Bar",
    "date": "2025-12-23",
    "title": "THE GET DOWN",
    "artists": [
      "DJ Funky Fresh Mike"
    ],
    "startTime": "21:00",
    "url": "https://ra.co/events/2305683"
  },
  {
    "id": "fcf19230",
    "venue": "Gewölbe",
    "date": "2025-12-24",
    "title": "Heiligabend with Shumi",
    "artists": [
      "Shumi"
    ],
    "startTime": "23:00",
    "url": "https://ra.co/events/2307923"
  },
  {
    "id": "19b0a4af",
    "venue": "fi",
    "date": "2025-12-27",
    "title": "fi = altshift5 w / Pan Pot & Etage147",
    "artists": [
      "ananda priori",
      "Pan-Pot"
    ],
    "startTime": "23:00",
    "url": "https://ra.co/events/2287702"
  },
  {
    "id": "bf9343b3",
    "venue": "Carlswerk Victoria",
    "date": "2025-12-31",
    "title": "unreal NYEve-Rave x CARV, KUKO, Somewhen,",
    "artists": [
      "CARV",
      "OMAKS",
      "Johannes Schuster",
      "KUKO",
      "Neon Graveyard",
      "NYRA (DE)",
      "Somewhen"
    ],
    "startTime": "22:00",
    "url": "https://ra.co/events/2257581"
  }
]
