[
  {
    "title": "Gewölbe Open Air at Odonien",
    "venue": "Odonien",
    "date": "2026-05-14",
    "startTime": "14:00",
    "artists": [],
    "url": "https://gewoelbe.ticket.io/3CgheS1c/",
    "id": "e89d1207"
  },
  {
    "title": "Klubnacht",
    "venue": "Gewölbe",
    "date": "2026-05-22",
    "startTime": "23:00",
    "artists": [
      "DJ Hell",
      "Paty Vapor"
    ],
    "url": "https://gewoelbe.ticket.io/elmQzXQz/"
  },
  {
    "title": "Cologne Street Market",
    "venue": "Gewölbe",
    "date": "2026-05-23",
    "startTime": "23:00",
    "artists": [
      "c00lm8",
      "DJ Tjizza",
      "Vlizz & Yunes"
    ],
    "url": "https://gewoelbe.ticket.io/euFRDF6g/"
  },
  {
    "title": "Im Fokus",
    "venue": "Gewölbe",
    "date": "2026-05-30",
    "startTime": "23:00",
    "artists": [
      "Anna Cainelli & Denis Stockhausen",
      "Dimon & Bergen",
      "Gutkind"
    ],
    "url": "https://gewoelbe.ticket.io/hk01KFwR/",
    "id": "18d31087"
  },
  {
    "title": "Last Beat Standing",
    "venue": "Gewölbe",
    "date": "2026-06-12",
    "startTime": "23:00",
    "artists": [
      "Cinthie",
      "Meat"
    ],
    "url": "https://gewoelbe.ticket.io/CVK1x1C3/",
    "id": "49c77232"
  }
]
