[
  {
    "title": "My Dear",
    "venue": "Gewölbe",
    "date": "2026-11-06",
    "startTime": "23:00",
    "artists": [
      "Ellen Allien",
      "Denis Stockhausen"
    ],
    "url": "https://gewoelbe.ticket.io/MCG0QU1N/",
    "id": "d6685bd5"
  },
  {
    "title": "SOUNDSOUND",
    "venue": "Gewölbe",
    "date": "2026-11-07",
    "startTime": "23:00",
    "artists": [
      "Domenik Deckert",
      "Mike Momburg",
      "salute",
      "Skathi"
    ],
    "url": "https://gewoelbe.ticket.io/UWlmLVGK/"
  },
  {
    "title": "Elfter Elfter Phonovision",
    "venue": "Gewölbe",
    "date": "2026-11-11",
    "startTime": "16:00",
    "artists": [
      "Gianni & Various Identities",
      "Pavelo Promillo & Giorgio Inkasso",
      "Slaymira & Juno.J & DJ Ass Tits",
      "Sophti & HiHat"
    ],
    "url": "https://gewoelbe.ticket.io/udqC7G2j/"
  },
  {
    "title": "Klubnacht",
    "venue": "Gewölbe",
    "date": "2026-11-14",
    "startTime": "23:00",
    "artists": [
      "Michael Mayer (all night long)"
    ],
    "url": "https://gewoelbe.ticket.io/terfYe4k/"
  },
  {
    "title": "The Third Room",
    "venue": "Gewölbe",
    "date": "2026-11-20",
    "startTime": "23:00",
    "artists": [
      "Ahmet Sisman",
      "Claudio PRC",
      "Di²"
    ],
    "url": "https://gewoelbe.ticket.io/nspwLrRk/"
  }
]
