[
  {
    "id": "",
    "title": "fi x Langer Tag",
    "venue": "fi",
    "date": "2025-09-13",
    "startTime": "14:00",
    "artists": [
      "AMSL B2B LEONIE SAVALAS",
      "LENA M B2B NÂSCA",
      "RUFOUS B2B STEVE BONDE B2B ZAHARA",
      "DJ SWEET AND SOUR B2B NINI PANINI",
      "ELISEN B2B EVA MO B2B PILETA",
      "MF DUMM B2B O-LIN",
      "DJ AMP DAVID B2B SALT & PEPPER",
      "DJ PALGA B2B GIANNI B2B HIHAT",
      "NISHER B2B SKATHI"
    ],
    "url": "https://www.eventbrite.de/e/fi-x-langer-tag-tickets-1591235812149?aff=ebdsoporgprofile"
  },
  {
    "id": "1e57d56e",
    "title": "fi = altshift5 w/ Major League DJz & Barulho World & Serial Sound",
    "venue": "fi",
    "date": "2025-09-06",
    "startTime": "23:00",
    "artists": [
      "FOUDJO",
      "FRAU BEJI",
      "MAJOR LEAGUE DJZ",
      "PICCELL",
      "DJ BROM",
      "FELIX FLEER",
      "JONAS LANDWEHR"
    ],
    "url": "https://www.eventbrite.de/e/fi-altshift5-w-major-league-djz-barulho-world-serial-sound-tickets-1541511665889?aff=ebdsoporgprofile"
  },
  {
    "id": "4a38fd12",
    "title": "fi = altshift5 w/ Roman Flügel & 45 Years of Fein",
    "venue": "fi",
    "date": "2025-08-30",
    "startTime": "23:00",
    "artists": [
      "CARELESS",
      "MOTIP WHITE",
      "ROMAN FLÜGEL",
      "JOHANNES KLINGEBIEL B2B PHILIPP FEIN"
    ],
    "url": "https://www.eventbrite.de/e/fi-altshift5-w-roman-flugel-45-years-of-fein-tickets-1500402266569?aff=ebdsoporgprofile"
  }
]
