[
  {
    "id": "",
    "title": "Ascension with MASSAGIO, Critical Error, AVO2X, Dopair, Dana Roosy",
    "venue": "Helios37",
    "date": "2025-05-02",
    "startTime": "23:00",
    "artists": [
      "MASSAGIO",
      "AVO2X",
      "Bensonius",
      "Dana Roosy"
    ],
    "url": "https://ra.co/events/2150428"
  },
  {
    "id": "",
    "title": "Fejka",
    "venue": "Yuca Club",
    "date": "2025-05-02",
    "startTime": "19:00",
    "artists": [
      "Fejká"
    ],
    "url": "https://ra.co/events/2105644"
  },
  {
    "id": "",
    "title": "Intertrax with Radial Gaze & Etane",
    "venue": "Zum Scheuen Reh",
    "date": "2025-05-02",
    "startTime": "22:00",
    "artists": [
      "Radial Gaze",
      "Etane"
    ],
    "url": "https://ra.co/events/2150171"
  },
  {
    "id": "",
    "title": "CLUBNACHT - Free Entry",
    "venue": "Nachtigall",
    "date": "2025-05-02",
    "startTime": "23:00",
    "artists": [
      "Pardis"
    ],
    "url": "https://ra.co/events/2144847"
  },
  {
    "id": "",
    "title": "EhrenKlub in Odonien #20 mit Franky-B, Isabelle Beaucamp, SANTØS uvm",
    "venue": "Odonien",
    "date": "2025-05-03",
    "startTime": "23:00",
    "artists": [
      "ALLY",
      "Dana Roosy",
      "Franky-B",
      "Isabelle Beaucamp",
      "Tzaar",
      "DOCTOR MÜCKE"
    ],
    "url": "https://ra.co/events/2147734"
  },
  {
    "id": "",
    "title": "giegling in Köln",
    "venue": "fi",
    "date": "2025-05-03",
    "startTime": "23:00",
    "artists": [
      "Leafar Legov",
      "Edward",
      "Cosmo (KR)",
      "Konstantin",
      "Yamour",
      "UNOS"
    ],
    "url": "https://ra.co/events/2126262"
  },
  {
    "id": "",
    "title": "BergWacht Ladies Night w/ SUZé, Elotanz, Klarabell, JuNi",
    "venue": "Artheater",
    "date": "2025-05-03",
    "startTime": "23:00",
    "artists": [
      "SUZé"
    ],
    "url": "https://ra.co/events/2163398"
  },
  {
    "id": "",
    "title": "Hardfusion - Cyber Meltdown",
    "venue": "Domhof",
    "date": "2025-05-03",
    "startTime": "22:00",
    "artists": [],
    "url": "https://ra.co/events/2143283"
  },
  {
    "id": "",
    "title": "SECRETRAVES // BIG SUMMER OPENING // OPEN AIR",
    "venue": "TBA - SECRET OPEN AIR",
    "date": "2025-05-03",
    "startTime": "19:00",
    "artists": [],
    "url": "https://ra.co/events/2162671"
  }
]