[
  {
    "title": "Kinky Circus",
    "venue": "Club Bahnhof Ehrenfeld",
    "date": "2026-09-26",
    "startTime": "22:00",
    "artists": [
      "Adahsoe",
      "La Vache",
      "Finyx",
      "Maleeha",
      "Ellavic",
      "Spelta"
    ],
    "url": "https://www.kinkycircus.de/tickets/koeln-26-09-2026-standard-ticket/"
  }
]
