[
  {
    "title": "fi x DJ Mell G & Neue Wellen",
    "venue": "fi",
    "date": "2026-07-04",
    "startTime": "23:00",
    "artists": [
      "DJ MELL G",
      "2N1A",
      "SAVSANNAH",
      "FINE DINING",
      "VLIZZ",
      "YUNES"
    ],
    "url": "https://rausgegangen.de/en/events/fi-x-dj-mell-g-neue-wellen-0/",
    "id": "c5945f83"
  },
  {
    "title": "fi x Mama Snake & Loveselectors",
    "venue": "fi",
    "date": "2026-07-18",
    "startTime": "23:00",
    "artists": [
      "HENSO",
      "MAMA SNAKE",
      "NO:ELIA",
      "DJ KNUCKLE-BARRY",
      "JOHN WEGEHAUPT",
      "KOGI",
      "LIZZLE",
      "RAFIKI",
      "SNEAKY PETE",
      "ZINHO"
    ],
    "url": "https://rausgegangen.de/en/events/fi-x-mama-snake-loveselectors-0/",
    "id": "74332509"
  },
  {
    "title": "fi x NUOBN x Iptamenos Discos x Local Suicide",
    "venue": "fi",
    "date": "2026-07-24",
    "startTime": "23:00",
    "artists": [
      "ETANE",
      "LOCAL SUICIDE",
      "VIOLENCE MARY"
    ],
    "url": "https://rausgegangen.de/en/events/fi-x-nuobn-x-local-suicide-0/",
    "id": "5b8b038f"
  },
  {
    "title": "fi Garten x Langer Tag x Roman Flügel & Jonathan Kaspar & Barulho World uvm",
    "venue": "fi",
    "date": "2026-07-25",
    "startTime": "14:00",
    "artists": [
      "Roman Flügel",
      "Jonathan Kaspar",
      "Barulho World",
      "FrauBeji",
      "Piccell",
      "Frisotto",
      "Noah Boehm",
      "Henning Pott",
      "Yonah",
      "Kobi Föhres",
      "Arthur Uhing",
      "Lara G.",
      "Thalheimer"
    ],
    "url": "https://www.eventbrite.de/e/fi-garten-x-langer-tag-x-roman-flugel-jonathan-kaspar-barulho-world-uvm-tickets-1992487592024",
    "id": "b2a26b75"
  }
]