[
  {
    "id": "7550b070",
    "title": "Beats x Bass x Cologne w/ Sofie Sapuna #MittWochenende",
    "venue": "Odonien",
    "date": "2025-07-16",
    "startTime": "23:00",
    "artists": [
      "Sofie Sapuna",
      "Rosilicious",
      "LSG",
      "DJ Discostoff",
      "Gourski",
      "Enaly"
    ],
    "url": "https://ra.co/events/2208948"
  },
  {
    "id": "b199d3ac",
    "title": "Andhim in Odonien",
    "venue": "Odonien",
    "date": "2025-07-18",
    "startTime": "23:00",
    "artists": [
      "Andhim",
      "Rafael Da Cruz",
      "Julian Bomm",
      "Mike Momburg"
    ],
    "url": "https://ra.co/events/2189227"
  },
  {
    "id": "a2f94344",
    "title": "THICK & JUICY - KHM Rundgangsparty 2025",
    "venue": "JAKI",
    "date": "2025-07-18",
    "startTime": "23:00",
    "artists": [
      "Sedaction",
      "low Ki"
    ],
    "url": "https://ra.co/events/2211896"
  },
  {
    "id": "83c78b0a",
    "title": "Technoblock Hardtechno x Hardbounce Session",
    "venue": "Elektroküche",
    "date": "2025-07-19",
    "startTime": "23:00",
    "artists": [
      "FØSS",
      "Boltcore",
      "Faronis"
    ],
    "url": "https://ra.co/events/2202913"
  },
  {
    "id": "2b069946",
    "title": "BergWacht in Odonien with Miss Melera, Lampé uvm",
    "venue": "Odonien",
    "date": "2025-07-19",
    "startTime": "23:00",
    "artists": [
      "Miss Melera",
      "Lampé",
      "Liho"
    ],
    "url": "https://ra.co/events/2199370"
  },
  {
    "id": "322a3757",
    "title": "inner rhythm",
    "venue": "Tanzfaktur",
    "date": "2025-07-19",
    "startTime": "14:00",
    "artists": [
      "Nadim",
      "HiHat",
      "DJ Palga"
    ],
    "url": "https://ra.co/events/2196488"
  },
  {
    "id": "a1670f67",
    "title": "Tom-Tom Club feat. DJ Lu & Nadim",
    "venue": "JAKI",
    "date": "2025-07-19",
    "startTime": "23:30",
    "artists": [
      "Nadim"
    ],
    "url": "https://ra.co/events/2200041"
  },
  {
    "id": "28f77686",
    "title": "VICE BOAT CRUISE 2025 with Leon Hagen & Pascal Wagner (HOOVE)",
    "venue": "TBA - Anleger 13 - Bastei Köln (MS Rheinland)",
    "date": "2025-07-19",
    "startTime": "16:30",
    "artists": [
      "Leon Hagen",
      "Pascal Wagner"
    ],
    "url": "https://ra.co/events/2210643"
  },
  {
    "id": "bd6589b3",
    "title": "fi x Lange Nacht",
    "venue": "fi",
    "date": "2025-07-19",
    "startTime": "18:00",
    "artists": [
      "Philipp Stoffel",
      "Mike Momburg",
      "Leon Hagen",
      "Pascal Wagner"
    ],
    "url": "https://ra.co/events/2209647"
  },
  {
    "id": "6bc56a82",
    "title": "FLINTA* DJ CONTEST - GIRLS JUST WANNA HAVE FUN'",
    "venue": "H26",
    "date": "2025-07-19",
    "startTime": "22:00",
    "artists": [
      "AGNY"
    ],
    "url": "https://ra.co/events/2212560"
  },
  {
    "id": "7f6d49e0",
    "title": "Beats x Bass x Cologne #MittWochenende",
    "venue": "Odonien",
    "date": "2025-07-23",
    "startTime": "23:00",
    "artists": [],
    "url": "https://ra.co/events/2208992"
  },
  {
    "id": "f98eb2d8",
    "title": "Sommer Rave at Odonien",
    "venue": "Odonien",
    "date": "2025-07-25",
    "startTime": "23:00",
    "artists": [
      "Ankytrixx",
      "Alchemiah",
      "Kos:mo",
      "Shaun Moses",
      "Steven Shade",
      "Laura Foxx"
    ],
    "url": "https://ra.co/events/2170037"
  },
  {
    "id": "ff7f1ab5",
    "title": "Austin Millz pres by Bootshaus LIVE",
    "venue": "Bootshaus",
    "date": "2025-07-25",
    "startTime": "19:00",
    "artists": [
      "Austin Millz"
    ],
    "url": "https://ra.co/events/2195675"
  },
  {
    "id": "146ab00a",
    "title": "FOR FREE - Artheater SUMMER SPECIAL I",
    "venue": "Artheater",
    "date": "2025-07-25",
    "startTime": "23:00",
    "artists": [
      "Redfocks",
      "DJ VENUSSS"
    ],
    "url": "https://ra.co/events/2212653"
  },
  {
    "id": "70987d70",
    "title": "fi = altshift5 with Marcel Dettmann & Plasma & rau.ton",
    "venue": "fi",
    "date": "2025-07-26",
    "startTime": "23:00",
    "artists": [
      "Elisen",
      "Marcel Dettmann",
      "BORGBORG",
      "makahaun",
      "Rostøm"
    ],
    "url": "https://ra.co/events/2209588"
  },
  {
    "id": "e938f2bd",
    "title": "BZZBZZ TECHNO X RCL w/Raven",
    "venue": "Helios37",
    "date": "2025-07-26",
    "startTime": "23:00",
    "artists": [
      "Raven (CA)",
      "SPEEDO (2)",
      "KACHU2K"
    ],
    "url": "https://ra.co/events/2208076"
  },
  {
    "id": "56e2896f",
    "title": "In Limbo Audio Open Air",
    "venue": "Autonomes Zentrum",
    "date": "2025-07-26",
    "startTime": "14:00",
    "artists": [
      "AMSL",
      "Motip White",
      "Separat"
    ],
    "url": "https://ra.co/events/2211137"
  },
  {
    "id": "249426a5",
    "title": "DJ DIESEL pres. by SHAQ´S BASS ALL-STARS",
    "venue": "Bootshaus",
    "date": "2025-07-26",
    "startTime": "22:00",
    "artists": [
      "San Holo"
    ],
    "url": "https://ra.co/events/2186555"
  },
  {
    "id": "987531b4",
    "title": "HNTR PRES BY Bootshaus",
    "venue": "Bootshaus",
    "date": "2025-07-26",
    "startTime": "23:00",
    "artists": [
      "HNTR",
      "Nic Lorenz"
    ],
    "url": "https://ra.co/events/2171583"
  },
  {
    "id": "ff9d3cb2",
    "title": "Tom-Tom Club x Diana Kollektiv x Another Thought",
    "venue": "JAKI",
    "date": "2025-07-26",
    "startTime": "23:30",
    "artists": [],
    "url": "https://ra.co/events/2196577"
  },
  {
    "id": "dc791c97",
    "title": "AMAPIANO FEST - OPEN AIR EDITION",
    "venue": "TBA - MOXY COLOGNE/BONN AIRPORT",
    "date": "2025-07-27",
    "startTime": "16:00",
    "artists": [
      "DJ Freegah",
      "Cajoux"
    ],
    "url": "https://ra.co/events/2201230"
  },
  {
    "id": "be0a9510",
    "title": "Bootshaus on a Ship with Muzz, Subsonic, Aeon:Mode",
    "venue": "TBA",
    "date": "2025-07-27",
    "startTime": "14:00",
    "artists": [
      "Gourski"
    ],
    "url": "https://ra.co/events/2185978"
  },
  {
    "id": "13789217",
    "title": "Beats x Bass x Cologne #MittWochenende",
    "venue": "Odonien",
    "date": "2025-07-30",
    "startTime": "23:00",
    "artists": [],
    "url": "https://ra.co/events/2208994"
  },
  {
    "id": "d2ece4e7",
    "title": "ART OF URBAN LIFE SPECIAL - BIRTHDAY RAVE",
    "venue": "Artheater",
    "date": "2025-08-01",
    "startTime": "23:00",
    "artists": [
      "CÖLN",
      "SITTENLOS",
      "DJ SODBRENNEN"
    ],
    "url": "https://ra.co/events/2208485"
  },
  {
    "id": "0c0f0d7e",
    "title": "Techno Allianz Pres. 1 Year Schranz Only Local Night",
    "venue": "Elektroküche",
    "date": "2025-08-02",
    "startTime": "23:00",
    "artists": [
      "Ropemaker",
      "Roben Gardemann",
      "I.D.A"
    ],
    "url": "https://ra.co/events/2169254"
  },
  {
    "id": "2ac2dd1d",
    "title": "Techno Dampfer Köln with Spartaque",
    "venue": "TBA - Am Leystapel auf der Höhe des Schokoladenmuseums, Köln",
    "date": "2025-08-02",
    "startTime": "17:00",
    "artists": [
      "Spartaque"
    ],
    "url": "https://ra.co/events/2121363"
  },
  {
    "id": "95eabbc2",
    "title": "GUTE NACHT! mit Chrissyjeey und sarah4K im Helios37",
    "venue": "Helios37",
    "date": "2025-08-02",
    "startTime": "23:00",
    "artists": [
      "Bounce MC",
      "sarah4K",
      "Speedo"
    ],
    "url": "https://ra.co/events/2207876"
  },
  {
    "id": "4c7689a4",
    "title": "FOR FREE - Artheater SUMMER SPECIAL II",
    "venue": "Artheater",
    "date": "2025-08-02",
    "startTime": "23:00",
    "artists": [
      "alleira",
      "Arninho",
      "BOLZ"
    ],
    "url": "https://ra.co/events/2212656"
  }
]