[
  {
    "id": "1d50f8b8",
    "title": "MITTWOCHENENDE feat. RAVES of GERMANY & MK RAVES",
    "venue": "Odonien",
    "date": "2025-10-01",
    "startTime": "23:00",
    "artists": [
      "Simba",
      "Super Dario",
      "Dj Danevska",
      "Dj Eddyble",
      "Dj MÃ¤sisch B2B ISSAM",
      "Dr Pheelgood",
      "Rui Da Silva",
      "Bbxngz",
      "Prayinhell",
      "Zoltec"
    ],
    "url": "https://tonite.ticket.io/8D6vdzsF/"
  }
]