[
  {
    "title": "WIR Schwestern ･ New Frequencies",
    "venue": "Odonien",
    "date": "2026-08-01",
    "startTime": "23:00",
    "artists": [
      "LOLSNAKE",
      "ESZTER",
      "REDFOCKS",
      "CALI CARACHO",
      "RACHEL RAW",
      "ROMY MVP",
      "GRETA PEROLA",
      "LEYA",
      "VIBE & VIPER",
      "ENNA"
    ],
    "url": "https://rausgegangen.de/events/wir-schwestern-new-frequencies-august-rush-0/",
    "id": "9dbc2c56"
  },
  {
    "title": "Electronic Summer of Love '26 (Friday)",
    "venue": "Odonien",
    "date": "2026-08-07",
    "startTime": "23:00",
    "artists": [
      "Laura vom Jupiter",
      "LIEKS",
      "Matech",
      "NVNS",
      "Perle",
      "Chaya",
      "Isabelle Beaucamp",
      "IN FURCHT",
      "SUP"
    ],
    "url": "https://rausgegangen.de/events/electronic-summer-of-love-2026-the-odonien-festival-part-xiv-0/",
    "id": "1fc116f4"
  },
  {
    "title": "Electronic Summer of Love '26 (Saturday Day Rave)",
    "venue": "Odonien",
    "date": "2026-08-08",
    "startTime": "14:00",
    "artists": [
      "Danilo Filipe",
      "DJ Sodbrennen",
      "Jacuzi",
      "Limoncello",
      "Lola Cerise",
      "Ben Techy",
      "DJ Danevska",
      "EDNA",
      "Pipo",
      "ROWIN",
      "Bish",
      "Enaly",
      "Gourski",
      "LAETi",
      "Natty Lou",
      "Omox"
    ],
    "url": "https://rausgegangen.de/events/electronic-summer-of-love-2026-the-odonien-festival-part-xiv-0/",
    "id": "07dccb6f"
  },
  {
    "title": "SUMMER RAVE in ODONIEN by ART OF URBAN LIFE & ONLYRAVES",
    "venue": "Odonien",
    "date": "2026-08-22",
    "startTime": "23:00",
    "artists": [],
    "url": "https://tonite.ticket.io/dIQ2mcZp/",
    "id": "c0867e39"
  }
]