[
  {
    "title": "Alaaf mit saus & braus / Rheinfeuern",
    "venue": "Odonien",
    "date": "2026-11-11",
    "startTime": "14:00",
    "artists": [
      "Oliver Koletzki",
      "Adriano Rosso b2b Jeremy Reinhard",
      "Fabian Sprungk",
      "Henning Pott",
      "Lukas Thalheimer",
      "Janelie",
      "Lilah",
      "Nick Lase"
    ],
    "url": "https://www.eventbrite.de/e/1111-in-odonien-18h-outdoorindoor-rave-i-oliver-koletzki-uvm-tickets-2000522654111",
    "id": "3dafb861"
  }
]