[
  {
    "title": "Phonovision CSD",
    "venue": "Gewölbe",
    "date": "2026-07-04",
    "startTime": "23:00",
    "artists": [
      "Alleira & Skathi",
      "DJ Ass Tits & Various Identities",
      "DJ Fucks Himself & HiHat"
    ],
    "url": "https://gewoelbe.ticket.io/4C4Mq92X/",
    "id": "c2fb3604"
  },
  {
    "title": "Jack This",
    "venue": "Gewölbe",
    "date": "2026-07-11",
    "startTime": "23:00",
    "artists": [
      "Clara Luise",
      "Pancratio",
      "Måtyrer"
    ],
    "url": "https://gewoelbe.ticket.io/MWK2ya3V/",
    "id": "28967670"
  },
  {
    "title": "Gewölbe @Odonien",
    "venue": "Odonien",
    "date": "2026-07-31",
    "startTime": "23:00",
    "artists": [],
    "url": "https://gewoelbe.ticket.io/7CWbGZ6s/",
    "id": "7330a795"
  }
]