[
  {
    "id": "0b99aad3",
    "title": "PSYCHO THRILL :: 34 Years of Science Friction Techno",
    "venue": "somewhere in Cologne :D",
    "date": "2025-12-06",
    "startTime": "22:00",
    "artists": [
      "ALEC TUCKER",
      "CLAUS BACHOR",
      "DJ ALTO",
      "DRIVETRAIN",
      "DRUM:MAJOR 2525",
      "MaeshRoombOY UA",
      "MARKUS FUNKE",
      "REDMADVELVET",
      "ROLAND CASPER"
    ],
    "url": "https://www.facebook.com/events/1314256426644061/"
  }
]