[
  {
    "id": "cbf8771b",
    "title": "High Voltage X KÃ¶ln ist Techno - prod. by MATTERMIND",
    "venue": "BOGEN 2",
    "date": "2025-10-02",
    "startTime": "23:00",
    "artists": [
      "@ambam.69",
      "@bbxngz",
      "@dana.roosy",
      "@jowijane",
      "@sofiesapuna_music"
    ],
    "url": "https://www.mattermindevents.de/highvoltage"
  }
]