[
  {
    "title": "fi x Patrick Mason & Loveselectors",
    "venue": "fi",
    "date": "2026-10-03",
    "startTime": "23:00",
    "artists": [
      "Patrick Mason",
      "Eva Mo",
      "Juni",
      "DJ Ass Tits",
      "Juno",
      "Rafiki b2b Zinho"
    ],
    "url": "https://rausgegangen.de/en/events/fi-x-patrick-mason-loveselectors-0/",
    "id": "f3a88ec0"
  },
  {
    "title": "fi x Lammer & Wetdreams & SoundSound",
    "venue": "fi",
    "date": "2026-10-09",
    "startTime": "23:00",
    "artists": [
      "Lammer",
      "Mismatch b2b M4X",
      "Bædura b2b Lizzle",
      "909 Racing Team b2b Vagabund",
      "Carl Bergé",
      "Skathi b2b Alleira"
    ],
    "url": "https://rausgegangen.de/en/events/fi-x-lammer-wetdreams-soundsound-0/",
    "id": "36b1d615"
  },
  {
    "title": "fi x Rene Wise & Das Ist Das Ja",
    "venue": "fi",
    "date": "2026-10-10",
    "startTime": "23:00",
    "artists": [
      "Rene Wise",
      "Mariami",
      "Medea",
      "0megavybe",
      "Anatoli b2b Dennis Janeczek",
      "Jan Oben"
    ],
    "url": "https://ursprung-fi.de/",
    "id": "24bc4db3"
  },
  {
    "title": "fi x The Hacker & Hoove",
    "venue": "fi",
    "date": "2026-10-16",
    "startTime": "23:00",
    "artists": [
      "The Hacker",
      "Alfalfa b2b Julian Bomm",
      "Krackk",
      "Greta Perola",
      "Leon Hagen",
      "Thalo Santana"
    ],
    "url": "https://rausgegangen.de/en/events/fi-x-the-hacker-hoove-0/",
    "id": "6ad5e944"
  },
  {
    "title": "fi x Kollektiv Turmstrasse & Jonathan Kaspar & friendly Connections",
    "venue": "fi",
    "date": "2026-10-17",
    "startTime": "23:00",
    "artists": [
      "Kollektiv Turmstrasse (live)",
      "Jonathan Kaspar",
      "Herkules Underground",
      "We Love Warmups",
      "Zweite Sahne"
    ],
    "url": "https://www.eventbrite.de/e/fi-x-kollektiv-turmstrasse-jonathan-kaspar-friendly-connections-tickets-1998414548711",
    "id": "109f3c09"
  },
  {
    "title": "fi x Henrik Schwarz & AYA",
    "venue": "fi",
    "date": "2026-10-23",
    "startTime": "23:00",
    "artists": [
      "Henrik Schwarz (live)",
      "Bamina b2b Efuru",
      "Bonjour Ben",
      "c00lm8",
      "Neeks b2b Monsi"
    ],
    "url": "https://rausgegangen.de/en/events/fi-x-henrik-schwarz-aya-0/",
    "id": "36702a0f"
  },
  {
    "title": "fi x Brutalism x Waidmarkt",
    "venue": "fi",
    "date": "2026-10-24",
    "startTime": "23:00",
    "artists": [
      "Cio D'Or",
      "Dornen",
      "Function",
      "lomi",
      "Grim",
      "Kgavasheli",
      "Philip Morris"
    ],
    "url": "https://rausgegangen.de/en/events/fi-x-brutalism-x-waidmarkt-0/",
    "id": "ef47c294"
  },
  {
    "title": "fi x Kittin & Lafari",
    "venue": "fi",
    "date": "2026-10-31",
    "startTime": "23:00",
    "artists": [
      "Kittin",
      "Etane",
      "Pileta",
      "Daddy Dee",
      "Rufous",
      "Steve Bonde",
      "Uwe Lacto",
      "Zahara"
    ],
    "url": "https://rausgegangen.de/en/events/fi-x-kittin-lafari-0/",
    "id": "4d8e3c09"
  }
]