[

  {
    "id": "3ca0a252",
    "venue": "Bootshaus",
    "date": "2025-05-23",
    "title": "CHROME COLOGNE W. JAZZY, OMAKS, SECRET GUEST & MORE",
    "artists": [
      "JAZZY (2)",
      "OMAKS",
      "HOEHENANGST",
      "Leonard Palm",
      "Tzaar"],
    "startTime": "23:00",
    "url": "https://bootshaus-club.ticket.io/0mckscju/?fbclid=PAZXh0bgNhZW0CMTEAAachtSEwbiVUVh3obv4o3GHh8DRx7a4JoIZYB1fjm9JIU-k5Ju8WVC9QUBBETw_aem_Fh1s1TXt239nbwpvHgMqCw"
  },

  { "venue": "Helios 37",
    "date": "2025-04-26",
    "title": "NURBÖSE – 26.04.2025 – Tag der Lesbischen Sichtbarkeit",
    "artists": [
      "Métaraph",
      "Døpair",
      "Nina Sativa",
      "Sadicca"
    ],
    "startTime": "23:00",
    "url": "https://t.rausgegangen.de/tickets/nurbose-26042025"
  },
  { "venue": "Helios 37",
    "date": "2025-05-24",
    "title": "NURBÖSE – 26.04.2025 – Tag der Lesbischen Sichtbarkeit",
    "artists": [
      "Métaraph",
      "Døpair",
      "Nina Sativa",
      "Sadicca"
    ],
    "startTime": "23:00",
    "url": "https://t.rausgegangen.de/tickets/nurbose-26042025"
  },

  { "venue": "Club Zimmermanns",
    "date": "2025-05-17",
    "title": "Kinky Techno & Friends ",
    "artists": ["Moekli",
      "Hill",
      "Gerrit X",
      "Deniz (LJ)"],
    "startTime": "22:00",
    "url": "https://www.instagram.com/p/DGDR6fANkiA/"
  }
]