[
  {
    "venue": "Garagen Club",
    "date": "2026-08-28",
    "title": "CHIN CHIN im Zauberwald",
    "startTime": "20:00",
    "artists": [
      "Lilah",
      "Nico Held B2B Lou.Key",
      "ENNA B2B Vinni",
      "Finyx",
      "Erasmus wie Orgasmus ",
      "Luzia",
      "MARRED",
      "Maxim"
    ],
    "url": "https://ausgehfuchs-dpcy.vivenushop.com/event/chin-chin-im-zauberwald-dqhf7n?utm_campaign=W7oU23MY&utm_source=shareable_link",
    "id": "6f82d003"
  },
  {
    "venue": "Garagen Club",
    "date": "2026-03-21",
    "title": "NURFLUID Köln",
    "startTime": "23:00",
    "artists": [
      "Nur Jaber",
      "Nana Yaa",
      "Heepmann",
      "Døpair",
      "Bouncy Bitch",
      "Selunia",
      "B!B!",
      "Zuza"
    ],
    "url": "https://nurboese.de/events/nurfluid-koeln-21-03-2026/",
    "id": "bdab9d39"
  },
  {
    "venue": "Helios37",
    "date": "2026-04-18",
    "title": "NURBÖSE Köln",
    "startTime": "23:00",
    "artists": [
      "MÉTARAPH",
      "ARES",
      "DØPAIR",
      "SØSSA"
    ],
    "url": "https://rausgegangen.de/en/events/nurbose-1804-0/?mtm_campaign=teilen_gewinnspiel&mtm_kwd=web",
    "id": "1aa040e2"
  },
  {
    "venue": "Helios37",
    "date": "2026-05-16",
    "title": "NURBÖSE Köln",
    "startTime": "23:00",
    "artists": [
      "Neon Graveyard",
      "DØPAIR",
      "Esther",
      "Sadicca b2b Maddycation"
    ],
    "url": "https://rausgegangen.de/en/events/nurbose-1605-0/?action=participate-lottery-nurbose-1605-0?mtm_campaign=teilen_gewinnspiel&mtm_kwd=web",
    "id": "9cd25a16"
  },
  {
    "venue": "Artheater",
    "date": "2026-06-13",
    "title": "NURFLUID Köln",
    "startTime": "23:00",
    "artists": [
      "Bouncy Bitch",
      "Falk",
      "Leo Pardy",
      "Szunflower",
      "Mami Wata",
      "Cristian Martinez"
    ],
    "url": "https://nurboese.de/events/nurfluid-13-06/",
    "id": "af74310e"
  },
  {
    "venue": "Garagen Club",
    "date": "2026-07-04",
    "title": "NURBÖSE Open Air",
    "startTime": "13:00",
    "artists": [],
    "url": "https://rausgegangen.de/en/events/nurbose-472026-open-air-0/",
    "id": "63f239fd"
  },
  {
    "venue": "Helios37",
    "date": "2026-08-15",
    "title": "NURBÖSE 15.08",
    "startTime": "23:00",
    "artists": [
      "Dannae",
      "Skippo",
      "Crlz",
      "Calima"
    ],
    "url": "https://rausgegangen.de/en/events/nurbose-1508-0/?mtm_campaign=teilen_gewinnspiel&mtm_kwd=web",
    "id": "1de75608"
  },
  {
    "venue": "Helios37",
    "date": "2026-09-19",
    "title": "NURBÖSE 19.09",
    "startTime": "23:00",
    "artists": [
      "Métaraph",
      "Tariel",
      "Cöln",
      "Deysie"
    ],
    "url": "https://rausgegangen.de/en/events/nurbose-1508-1/"
  }
]
