[
  {
    "id": "12e17e2b",
    "venue": "Garagen",
    "date": "2026-02-25",
    "title": "TECHNOLiEBE #AmMittwoch",
    "artists": [],
    "startTime": "20:00",
    "url": "https://ra.co/events/2376939"
  },
  {
    "id": "295360ea",
    "venue": "Elektroküche",
    "date": "2026-02-28",
    "title": "Schranz Only w/TEKKERKANE",
    "artists": [
      "I.D.A"
    ],
    "startTime": "23:00",
    "url": "https://ra.co/events/2342784"
  },
  {
    "id": "4cd8ab3f",
    "venue": "Schrotty",
    "date": "2026-02-28",
    "title": "VOOV PARTY OMIKI-PHAXE-SENSIFEEL",
    "artists": [],
    "startTime": "23:00",
    "url": "https://ra.co/events/2374431"
  },
  {
    "id": "12af7a86",
    "venue": "Odonien",
    "date": "2026-03-06",
    "title": "Lichtblick- Season opening 2026 in Odonien",
    "artists": [
      "Alchemiah",
      "Brtinzz",
      "Gilles Bock",
      "Kos:mo"
    ],
    "startTime": "23:00",
    "url": "https://ra.co/events/2321747"
  },
  {
    "id": "06c049ed",
    "venue": "Yuca Club",
    "date": "2026-03-06",
    "title": "EERIE X LOCAL BASS  with BUKEZ FINEZT, Roklem, Sebalo & many more",
    "artists": [
      "BUKEZ FINEZT",
      "Roklem",
      "Sebalo"
    ],
    "startTime": "23:00",
    "url": "https://ra.co/events/2369523"
  },
  {
    "id": "4f3b4c95",
    "venue": "Schrotty",
    "date": "2026-03-06",
    "title": "BZZBZZ TECHNO X MILLIAMPERE",
    "artists": [
      "Paralich",
      "DJ HÖRDE",
      "Eurodance2000",
      "SPEEDO (2)",
      "YËDM",
      "Athina",
      "Shemm",
      "Pamela Rave",
      "HENNESY",
      "PANA (Ger)"
    ],
    "startTime": "23:00",
    "url": "https://ra.co/events/2360225"
  },
  {
    "id": "36a238db",
    "venue": "Artheater",
    "date": "2026-03-06",
    "title": "303 presents O.B.I. & Frederic. (All Night Long)",
    "artists": [
      "O.B.I. (DE)",
      "Frederic.",
      "LSG",
      "Lianka"
    ],
    "startTime": "23:00",
    "url": "https://ra.co/events/2330549"
  },
  {
    "id": "b8b831ee",
    "venue": "Garagen",
    "date": "2026-03-06",
    "title": "BEATS x BASS x WEEKENDER hosted by BLOOMCAST",
    "artists": [
      "Rosilicious",
      "Fae Morgana"
    ],
    "startTime": "23:00",
    "url": "https://ra.co/events/2375480"
  },
  {
    "id": "7529e9b5",
    "venue": "fi",
    "date": "2026-03-06",
    "title": "fi = altshift5 with Ellen Allien & Etage147",
    "artists": [
      "Shaleen"
    ],
    "startTime": "23:00",
    "url": "https://ra.co/events/2349249"
  },
  {
    "id": "862efe42",
    "venue": "Helios37",
    "date": "2026-03-06",
    "title": "akt Party",
    "artists": [
      "KLARYOKO",
      "alleira"
    ],
    "startTime": "23:00",
    "url": "https://ra.co/events/2361021"
  },
  {
    "id": "29732710",
    "venue": "JAKI",
    "date": "2026-03-06",
    "title": "JAKI presents: All Night Long with Nadim b2b SPECIAL GUEST",
    "artists": [
      "Nadim"
    ],
    "startTime": "23:30",
    "url": "https://ra.co/events/2373078"
  },
  {
    "id": "76c65b1b",
    "venue": "Bootshaus",
    "date": "2026-03-06",
    "title": "LUKE MADNESS ALL NIGHT LONG [360°]",
    "artists": [],
    "startTime": "23:00",
    "url": "https://ra.co/events/2361298"
  },
  {
    "id": "cfd76811",
    "venue": "Kunstwerk",
    "date": "2026-03-07",
    "title": "Øhne Bedenken x 969 - Kollektiv Nacht VOL. II",
    "artists": [
      "Kashinski",
      "PATEK!",
      "andré wiese",
      "bashii (2)",
      "Dj Bowlz"
    ],
    "startTime": "23:00",
    "url": "https://ra.co/events/2365892"
  },
  {
    "id": "32e5a74f",
    "venue": "Bootshaus",
    "date": "2026-03-07",
    "title": "9 YEARS NIBIRII pres. VINI VICI / POLTERGST",
    "artists": [
      "Mr.Black (UK)",
      "DELTA LABS",
      "Paranormila",
      "Rui Da Silva",
      "Enaly",
      "Gourski",
      "LYNE"
    ],
    "startTime": "22:00",
    "url": "https://ra.co/events/2344161"
  },
  {
    "id": "995e5e88",
    "venue": "Helios37",
    "date": "2026-03-07",
    "title": "240KM/H pres. International Women's Day Charity",
    "artists": [
      "Riana Holley",
      "TANJA MIJU"
    ],
    "startTime": "23:00",
    "url": "https://ra.co/events/2353469"
  },
  {
    "id": "00c1d33b",
    "venue": "fi",
    "date": "2026-03-07",
    "title": "fi = altshift5 with 3000 Grad & Tiefgang",
    "artists": [
      "Katzengold",
      "Mollono.Bass",
      "nøvae",
      "J.WOCKENFUSS",
      "NORO",
      "ZHTA"
    ],
    "startTime": "23:00",
    "url": "https://ra.co/events/2349587"
  },
  {
    "id": "c03c1a14",
    "venue": "Odonien",
    "date": "2026-03-07",
    "title": "Anti Disco with Lars Eidinger (DJ-Set)",
    "artists": [
      "Lars Eidinger"
    ],
    "startTime": "23:00",
    "url": "https://ra.co/events/2349148"
  },

  {
    "id": "79abee3d",
    "venue": "Artheater",
    "date": "2026-03-07",
    "title": "jedermensch. with Caniche & Samantha Togni",
    "artists": [
      "Aaro (3)",
      "Caniche",
      "Samantha Togni",
      "EPHIE"
    ],
    "startTime": "23:00",
    "url": "https://ra.co/events/2362506"
  },
  {
    "id": "f5dffa88",
    "venue": "Blue Shell",
    "date": "2026-03-07",
    "title": "Neon Paradise x Cassetter - Syntwave/Cyberpunk Party",
    "artists": [],
    "startTime": "23:00",
    "url": "https://ra.co/events/2349454"
  },
  {
    "id": "feb41668",
    "venue": "Subway",
    "date": "2026-03-07",
    "title": "IMMERNOCH! TANZEN",
    "artists": [],
    "startTime": "17:00",
    "url": "https://ra.co/events/2360953"
  }
]
