[
  {
    "id": "f610c909",
    "title": "Space Invadrz Division ",
    "venue": "Lagerhauskai 1a",
    "date": "2026-08-29",
    "startTime": "22:00",
    "artists": [
      "DETUNE",
      "DANIEL ENGLISCH",
      "MUSE III",
      "MONTY",
      "REDMADVELVET"
    ],
    "url": "https://www.instagram.com/space_invadrz_division_s.i.d"
  }
]
