[
  {
    "id": "fe973136",
    "title": "Desire w/Pegassi ",
    "venue": "Schrotty",
    "date": "2025-10-02",
    "startTime": "23:00",
    "artists": [
      "Pegassi",
      "Beau Didier",
      "Kim Swim",
      "Human Safari",
      "Florian Picasso",
      "Gutkind",
      "Tschatsching"
    ],
    "url": "https://desire-world.ticket.io/Rw9gmhNZ/?utm_medium=paid&utm_source=ig&utm_id=6852456735533&utm_content=6852498116133&utm_term=6852456735733&utm_campaign=6852456735533&fbclid=PAb21jcAM9FPVleHRuA2FlbQEwAGFkaWQAAAY7evor_QGnnZxOyWJC_vO9TlcDDQR-bjnffe766tOXaYuKWZXhmm46jyXmOV0fHlqjQhk_aem_iOHf6WVJVuoYI3kxx6f75A"
  },
  {
    "id": "7f6eebb8",
    "title": "United Kinkdom",
    "venue": "Die Halle Tor 2",
    "date": "2025-10-17",
    "startTime": "21:30",
    "artists": [
      "TBD"
    ],
    "url": "https://anny.co/book/united-kinkdom-171025-die-halle-tor-2"
  },
  {
    "id": "5f04f3d5",
    "title": "Chin Chin Walhalla",
    "venue": "Club Bahnhof Ehrenfeld / YUCA",
    "date": "2025-11-29",
    "startTime": "23:00",
    "artists": [
      "Nico Held",
      "B!B!"
    ],
    "url": "https://vivenu.com/event/chin-chin-koln-walhalla-p15qb6"
  },
  {
    "id": "6ce39454",
    "title": "Unicorn Cologne women power night",
    "venue": "Klub Domhof",
    "date": "2025-10-10",
    "startTime": "22:00",
    "artists": [
      "Pardis",
      "Susi & Paula",
      "Rachel Raw",
      "Dilaval"
    ],
    "url": "https://www.holidayevents.net/unicorncologne-wpn"
  }
]